id,text,date,slug,category,interpretation
91,You are an artist - let your colors show.,2023-08-22,you-are-an-artist-let-your-colors-show,Creativity,"You may find yourself holding back ideas at work or in social settings because they feel unconventional. This fortune suggests that your unique perspective — whether it's proposing a creative solution in a meeting, decorating your space differently, or sharing your personal style — can actually set you apart and lead to recognition or fulfillment."
92,You have a good head for matters of the heart.,2023-08-22,you-have-a-good-head-for-matters-of-the-heart,Relationships,"In real situations like helping a friend through a breakup or deciding how to handle tension in your own relationship, you tend to balance logic and empathy well. Trust yourself when giving advice or making emotional decisions — you’re likely seeing things more clearly than you think."
93,There is no doubt that you will lead a good life.,2023-08-22,you-there-is-no-doubt-that-you-will-lead-a-good-life,Destiny,"Even if things feel uncertain — like career changes, financial stress, or personal setbacks — this points to a long-term pattern of stability and fulfillment. Small, consistent actions like saving money, maintaining relationships, and improving skills will compound into a life that feels secure and meaningful."
94,You don't need to travel far to find the satisfaction you're looking for.,2023-08-22,you-dont-need-to-travel-far-to-find-the-satisfaction-youre-looking-for,Contentment,"You might be thinking a big move, new job, or major change is the answer, but satisfaction could come from improving your current situation — like investing time in a hobby, strengthening a relationship, or appreciating what already works in your daily routine."
95,A new outlook will mean sunny skies ahead.,2023-08-22,a-new-outlook-will-mean-sunny-skies-ahead,Mindset,"If you're stuck on a frustrating problem — like a difficult coworker or a stalled project — trying a different perspective (such as seeing it as a learning experience or an opportunity to build patience) can reduce stress and reveal practical solutions you hadn't considered."
96,You may have a fantastic opportunity soon - be open to it.,2023-08-22,you-may-have-a-fantastic-opportunity-soon-be-open-to-it,Opportunity,"This could look like a casual conversation leading to a job offer, a side project turning into income, or an invitation you initially overlook. Saying yes, asking follow-up questions, or exploring something unfamiliar could turn a small moment into a major step forward."
97,"Be bold, try something new.",2023-08-22,be-bold-try-something-new,Personal Growth,"You might hesitate to apply for a role you're not fully qualified for, try a new social activity, or speak up in a meeting. Taking that step — even if it feels uncomfortable — can lead to growth, confidence, and opportunities you wouldn’t encounter by staying in your routine."
98,You have a contagious exuberance for life.,2023-08-22,you-have-a-contagious-exuberance-for-life,Personality,"Your energy can shift the mood of a group — like motivating coworkers during a slow project or making social gatherings more enjoyable. Being intentional about where you direct that energy can help you influence outcomes and build stronger connections."
99,You bring out the best in others.,2023-08-22,you-bring-out-the-best-in-others,Influence,"People may perform better around you because you listen, encourage, or challenge them constructively. For example, a teammate might feel more confident presenting ideas, or a friend might pursue a goal because of your support."
100,You shall attain great wisdom with each passing year.,2023-08-22,you-shall-attain-great-wisdom-with-each-passing-year,Wisdom,"Over time, situations that once confused you — like handling finances, relationships, or career decisions — become clearer because you’ve experienced similar challenges before. Reflecting on past mistakes and successes helps you make more confident, informed choices."
101,You hold the key to success.,2023-08-22,you-hold-the-key-to-success,Self-Agency,"If you're waiting for external validation, promotion, or the 'right moment,' this suggests progress depends more on your actions — like improving your skills, setting routines, or taking initiative — than on external circumstances."
102,Today's your lucky day.,2023-08-22,todays-your-lucky-day,Fortune,"You may notice things going your way — like catching someone in a good mood, receiving a quick approval, or having timing work in your favor. Use this by tackling something you've been putting off, such as asking for a favor or making a decision."
103,Any doubts you have will soon disappear.,2023-08-22,any-doubts-you-have-will-soon-disappear,Clarity,"If you're unsure about a decision — like choosing between jobs or addressing a relationship issue — new information or direct action (like asking questions or trying something out) will likely resolve your uncertainty."
104,Truth will be your biggest ally this month.,2023-08-22,truth-will-be-your-biggest-ally-this-month,Integrity,"Being honest in situations like workplace mistakes, financial discussions, or relationship conflicts may feel risky short-term, but it will prevent bigger problems and build trust over time."
105,You will soon be rewarded for your best efforts.,2023-08-22,you-will-soon-be-rewarded-for-your-best-efforts,Achievement,"If you’ve been consistently working toward something — like a promotion, improving a skill, or maintaining a relationship — you may soon see tangible results such as recognition, progress, or new opportunities."
106,Your effortless humor will help someone in need.,2023-08-22,your-effortless-humor-will-help-someone-in-need,Kindness,"In a tense or difficult moment — like a stressed coworker or a worried friend — your natural humor can lighten the mood, making the situation feel more manageable and helping others regain perspective."
107,You are destined for success and happiness.,2023-08-22,you-are-destined-for-success-and-happiness,Destiny,"While not everything will go smoothly, your general trajectory — through consistent effort, resilience, and good decisions — leans toward a stable and satisfying life, especially if you stay engaged and adaptable."
108,A surprise gift will leave a lasting impression.,2023-08-22,a-surprise-gift-will-leave-a-lasting-impression,Generosity,"This could be something small but meaningful — like a thoughtful message, unexpected help, or a gesture of appreciation — that strengthens a relationship and is remembered long after the moment passes."
109,You take criticism as an opportunity to grow.,2023-08-22,you-take-criticism-as-an-opportunity-to-grow,Self-Improvement,"When receiving feedback — like a performance review or personal critique — you’re able to separate emotion from usefulness, applying what helps and improving over time rather than becoming defensive."
110,You will make a change for the better.,2023-08-22,you-will-make-a-change-for-the-better,Transformation,"This could involve adjusting habits like spending, health, or time management. Even a small change — like waking earlier or setting boundaries — can noticeably improve your daily life."
85,A stranger's kindness will surprise and delight you.,2023-08-22,a-strangers-kindness-will-surprise-and-delight-you,Human Connection,"You might experience an unexpected helpful gesture — like someone assisting you without being asked or offering support at the right moment — which can restore your sense of trust in others."
87,You are admired by many.,2023-08-22,you-are-admired-by-many,Reputation,"People may respect your consistency, attitude, or work ethic more than they openly express. This could show up as being recommended for opportunities or quietly looked up to by peers."
89,A friends advice is invaluable.,2023-08-22,a-friends-advice-is-invaluable,Friendship,"When facing a difficult decision — like a career move or relationship issue — a trusted friend may offer insight you hadn’t considered, helping you avoid mistakes or see things more clearly."
111,You will be rewarded for your patience and understanding.,2023-08-22,you-will-be-rewarded-for-your-patience-and-understanding,Patience,"In situations like dealing with delays, misunderstandings, or difficult people, staying calm and empathetic may lead to better outcomes, such as stronger relationships or smoother resolutions."
112,An admirer is concealing affection for you.,2023-08-22,an-admirer-is-concealing-affection-for-you,Romance,"Someone in your circle — like a coworker or acquaintance — may appreciate you more than they openly show. Paying attention to consistent small gestures or attention could reveal their feelings."
113,You have the makings of a leader - take charge.,2023-08-22,you-have-the-makings-of-a-leader-take-charge,Leadership,"In group situations where no one is stepping up — like projects or planning — you may naturally have the clarity or confidence to organize others, make decisions, and move things forward."
114,Your dream will come true when you least expect it.,2023-08-22,you-dream-will-come-true-when-you-least-expect-it,Hope,"A goal you’ve been working toward — like a job, relationship, or personal milestone — may come through indirectly or at an unexpected time, especially if you continue preparing without obsessing over timing."
115,You are surrounded by unlimited opportunities.,2023-08-22,you-are-surrounded-by-unlimited-opportunities,Opportunity,"Opportunities may exist in your current job, network, or environment — like learning new skills, taking on responsibilities, or meeting new people — but require awareness and initiative to act on them."
116,You will have good luck in your personal affairs.,2023-08-22,you-will-have-good-luck-in-your-personal-affairs,Fortune,"Personal matters such as relationships, family situations, or home decisions may resolve more easily than expected, especially if you take small proactive steps."
117,Address the elephant in the room.,2023-08-22,address-the-elephant-in-the-room,Honesty,"Avoiding a known issue — like tension with a coworker or unresolved conflict — can create ongoing stress. Bringing it up directly (but respectfully) can clear misunderstandings and improve the situation."
560,Others are inspired by your courage.,2023-09-10,others-are-inspired-by-your-courage,Courage,"When you take risks or stand by your values — like speaking up or making a difficult decision — others notice and may feel encouraged to do the same in their own lives."
620,"Avoid unchallenging occupations, they waste your talents.",2023-09-29,avoid-unchallenging-occupations-they-waste-your-talents,Ambition,"If your work feels too easy or repetitive, you may become disengaged. Seeking roles or projects that stretch your abilities can lead to greater satisfaction and faster growth."
626,Someone is speaking well of you.,2023-10-17,someone-is-speaking-well-of-you,Reputation,"Your name may come up positively in conversations — like being recommended for a role or praised for your work — which can lead to new opportunities without your direct involvement."
990,Your keen sense of humor will make you many friends.,2025-12-29,your-keen-sense-of-humor-will-make-you-many-friends,Friendship,"Using humor in everyday interactions — like breaking the ice in new environments or easing tension — can help you build connections and make others feel comfortable around you."
995,Someone you respect will soon honor you.,2025-12-29,someone-you-respect-will-soon-honor-you,Recognition,"A mentor, boss, or respected peer may acknowledge your efforts — through praise, recommendation, or opportunity — especially if you’ve been consistently delivering quality work."
998,Your biggest battle will be won with the help of others.,2025-12-29,your-biggest-battle-will-be-won-with-the-help-of-others,Collaboration,"A major challenge — like a complex project or personal struggle — may require teamwork, advice, or emotional support. Reaching out can make the difference between struggle and success."
1000,Do not dwell on differences with a loved one - seek common ground.,2025-12-29,do-not-dwell-on-differences-with-a-loved-one-seek-common-ground,Relationships,"In disagreements, focusing on shared goals — like mutual respect or long-term happiness — can help resolve conflict more effectively than trying to 'win' the argument."
1002,Unforeseen financial resources will soon become available to you.,2025-12-29,unforeseen-financial-resources-will-soon-become-available-to-you,Finance,"This could appear as a bonus, refund, side income, or unexpected assistance. Being prepared — like having a plan for saving or investing — helps you make the most of it."
1004,Be willing to assert yourself in situations of great importance.,2025-12-29,be-willing-to-assert-yourself-in-situations-of-great-importance,Assertiveness,"When something truly matters — like salary negotiations or personal boundaries — clearly stating your needs and expectations can significantly influence the outcome."
1006,Your sense of humor will get you through difficult times.,2025-12-29,your-sense-of-humor-will-get-you-through-difficult-times,Resilience,"In stressful periods — like work pressure or personal setbacks — finding moments of humor can reduce tension and help you stay mentally balanced while working through challenges."
1016,Your courage will guide your future.,2026-01-03,your-courage-will-guide-your-future,Courage,"Future decisions — like changing careers, moving, or starting something new — may feel uncertain, but acting despite fear will open paths that wouldn’t exist otherwise."
1017,You set your sights high and enjoy striving for the best things in life,2026-03-28,you-set-your-sights-high-and-enjoy-striving-for-the-best-things-in-life,Ambition,"You are naturally drawn to ambitious goals — like advancing your career, improving your lifestyle, or achieving personal milestones. While this can lead to success, it’s important to balance high standards with patience and avoid burnout by pacing yourself."
1018,An unexpected windfall will soon be yours,2026-03-28,an-unexpected-windfall-will-soon-be-yours,Finance,"You may receive an unplanned financial gain — such as a bonus, gift, or new income opportunity. Using it wisely, like paying down debt or investing, can create longer-term stability rather than short-term spending."