id,text,date,slug,category,interpretation
91,You are an artist - let your colors show.,2023-08-22,you-are-an-artist-let-your-colors-show,Creativity,"Your individuality and creative instincts are valuable assets. Apply this by sharing your ideas openly, pursuing creative work, or expressing your perspective even in structured environments like work or problem-solving."
92,You have a good head for matters of the heart.,2023-08-22,you-have-a-good-head-for-matters-of-the-heart,Relationships,"You combine emotional awareness with sound judgment. When navigating relationship decisions or conflicts, trust your balanced perspective and help mediate or guide discussions."
93,There is no doubt that you will lead a good life.,2023-08-22,you-there-is-no-doubt-that-you-will-lead-a-good-life,Destiny,"Your long-term direction trends toward fulfillment. Focus less on short-term uncertainty and more on consistent habits that support health, relationships, and meaningful work."
94,You don't need to travel far to find the satisfaction you're looking for.,2023-08-22,you-dont-need-to-travel-far-to-find-the-satisfaction-youre-looking-for,Contentment,"The improvement you seek may already exist in your current environment. Consider investing attention in present relationships, hobbies, or local opportunities rather than searching elsewhere."
95,A new outlook will mean sunny skies ahead.,2023-08-22,a-new-outlook-will-mean-sunny-skies-ahead,Mindset,A change in perspective may unlock solutions that seemed unavailable. Try reframing a current challenge or asking how the situation could benefit your long-term growth.
96,You may have a fantastic opportunity soon - be open to it.,2023-08-22,you-may-have-a-fantastic-opportunity-soon-be-open-to-it,Opportunity,"Unexpected chances can appear in subtle ways. Pay attention to invitations, conversations, or ideas that initially seem small but could lead to significant advancement."
97,"Be bold, try something new.",2023-08-22,be-bold-try-something-new,Personal Growth,"Growth often requires experimentation. Apply this by learning a new skill, approaching a familiar task differently, or stepping into a role you would normally avoid."
98,You have a contagious exuberance for life.,2023-08-22,you-have-a-contagious-exuberance-for-life,Personality,"Your enthusiasm energizes others. Use it intentionally to motivate teams, uplift friends, or bring momentum to projects that require encouragement."
99,You bring out the best in others.,2023-08-22,you-bring-out-the-best-in-others,Influence,"Your presence encourages people to perform well. You can apply this by mentoring someone, offering thoughtful encouragement, or creating environments where others feel confident contributing."
100,You shall attain great wisdom with each passing year.,2023-08-22,you-shall-attain-great-wisdom-with-each-passing-year,Wisdom,Your experiences accumulate into insight. Reflect regularly on past successes and mistakes so those lessons inform future decisions.
101,You hold the key to success.,2023-08-22,you-hold-the-key-to-success,Self-Agency,"Your outcomes are largely shaped by your own decisions. Focus on disciplined action, setting clear priorities, and removing habits that undermine your goals."
102,Today's your lucky day.,2023-08-22,todays-your-lucky-day,Fortune,"Circumstances may temporarily favor you. Use the momentum by initiating something important, making a request, or advancing a decision you have delayed."
103,Any doubts you have will soon disappear.,2023-08-22,any-doubts-you-have-will-soon-disappear,Clarity,Uncertainty often resolves through action or new information. Continue investigating or progressing forward rather than waiting indefinitely for perfect certainty.
104,Truth will be your biggest ally this month.,2023-08-22,truth-will-be-your-biggest-ally-this-month,Integrity,Honesty and transparency will lead to the most stable outcomes. Address situations directly and avoid shortcuts that require concealment.
105,You will soon be rewarded for your best efforts.,2023-08-22,you-will-soon-be-rewarded-for-your-best-efforts,Achievement,Persistent work tends to compound. Continue investing effort in tasks where you have already built momentum rather than abandoning them prematurely.
106,Your effortless humor will help someone in need.,2023-08-22,your-effortless-humor-will-help-someone-in-need,Kindness,Humor can ease stress and strengthen connection. Use it thoughtfully to lift someone’s mood or reduce tension in difficult conversations.
107,You are destined for success and happiness.,2023-08-22,you-are-destined-for-success-and-happiness,Destiny,Your long-term path supports positive outcomes if you remain engaged. Continue building habits that align with your values and maintain resilience through temporary setbacks.
108,A surprise gift will leave a lasting impression.,2023-08-22,a-surprise-gift-will-leave-a-lasting-impression,Generosity,Unexpected generosity can strengthen relationships. Consider offering appreciation or assistance without expectation of return.
109,You take criticism as an opportunity to grow.,2023-08-22,you-take-criticism-as-an-opportunity-to-grow,Self-Improvement,Constructive feedback is a resource. Analyze criticism objectively and identify practical adjustments that improve your performance.
110,You will make a change for the better.,2023-08-22,you-will-make-a-change-for-the-better,Transformation,A decision or adjustment you are considering could improve your situation. Evaluate what habits or commitments should be refined or replaced.
85,A stranger's kindness will surprise and delight you.,2023-08-22,a-strangers-kindness-will-surprise-and-delight-you,Human Connection,Unexpected goodwill can restore perspective. Remain open to positive interactions and extend similar kindness when opportunities arise.
87,You are admired by many.,2023-08-22,you-are-admired-by-many,Reputation,Your behavior or character has earned respect. Use this credibility responsibly by supporting others and acting consistently with your values.
89,A friends advice is invaluable.,2023-08-22,a-friends-advice-is-invaluable,Friendship,"Trusted perspectives can reveal blind spots. When facing a difficult choice, seek input from someone who understands your goals."
111,You will be rewarded for your patience and understanding.,2023-08-22,you-will-be-rewarded-for-your-patience-and-understanding,Patience,Restraint and empathy often produce better long-term outcomes than reactive behavior. Continue giving situations time to resolve naturally.
112,An admirer is concealing affection for you.,2023-08-22,an-admirer-is-concealing-affection-for-you,Romance,Someone nearby may value you more than they openly express. Pay attention to subtle signals and remain receptive to new relationship possibilities.
113,You have the makings of a leader - take charge.,2023-08-22,you-have-the-makings-of-a-leader-take-charge,Leadership,"Your judgment and initiative are suited to guiding others. Consider stepping forward to organize efforts, clarify goals, or resolve uncertainty."
114,Your dream will come true when you least expect it.,2023-08-22,your-dream-will-come-true-when-you-least-expect-it,Hope,Major achievements sometimes arrive indirectly. Continue building skills and relationships so you are prepared when opportunities appear.
115,You are surrounded by unlimited opportunities.,2023-08-22,you-are-surrounded-by-unlimited-opportunities,Opportunity,"Potential paths exist around you, but they require recognition and action. Periodically review your environment for underused possibilities."
116,You will have good luck in your personal affairs.,2023-08-22,you-will-have-good-luck-in-your-personal-affairs,Fortune,Personal matters such as relationships or home life may move in a favorable direction. Take initiative in conversations or plans that strengthen those areas.
117,Address the elephant in the room.,2023-08-22,address-the-elephant-in-the-room,Honesty,Avoided issues rarely resolve themselves. Directly acknowledging a difficult topic can reduce tension and allow meaningful progress.
560,Others are inspired by your courage.,2023-09-10,others-are-inspired-by-your-courage,Courage,Your willingness to face challenges sets an example. Continue acting with integrity even when the path is uncertain.
620,"Avoid unchallenging occupations, they waste your talents.",2023-09-29,avoid-unchallenging-occupations-they-waste-your-talents,Ambition,"Your abilities benefit from meaningful difficulty. Seek roles or projects that require learning, strategy, or creativity."
626,Someone is speaking well of you.,2023-10-17,someone-is-speaking-well-of-you,Reputation,Positive comments about your work or character are circulating. Maintain consistent standards so your reputation continues strengthening.
990,Your keen sense of humor will make you many friends.,2025-12-29,your-keen-sense-of-humor-will-make-you-many-friends,Friendship,Humor encourages social connection. Use it to build rapport in new environments or strengthen existing friendships.
995,Someone you respect will soon honor you.,2025-12-29,someone-you-respect-will-soon-honor-you,Recognition,Acknowledgment from someone whose opinion matters to you may be approaching. Continue producing work or behavior worthy of that respect.
998,Your biggest battle will be won with the help of others.,2025-12-29,your-biggest-battle-will-be-won-with-the-help-of-others,Collaboration,"Complex challenges are rarely solved alone. Reach out for support, delegate tasks, and collaborate with people who complement your skills."
1000,Do not dwell on differences with a loved one - seek common ground.,2025-12-29,do-not-dwell-on-differences-with-a-loved-one-seek-common-ground,Relationships,Conflicts become manageable when shared goals are emphasized. Focus discussions on what both people value rather than on opposing positions.
1002,Unforeseen financial resources will soon become available to you.,2025-12-29,unforeseen-financial-resources-will-soon-become-available-to-you,Finance,Unexpected financial assistance or opportunity may appear. Prepare by managing resources carefully so you can use it effectively.
1004,Be willing to assert yourself in situations of great importance.,2025-12-29,be-willing-to-assert-yourself-in-situations-of-great-importance,Assertiveness,Important outcomes sometimes depend on clear communication of your needs. Practice stating your position confidently when stakes are high.
1006,Your sense of humor will get you through difficult times.,2025-12-29,your-sense-of-humor-will-get-you-through-difficult-times,Resilience,Humor can reduce stress and restore perspective during adversity. Use it as a coping mechanism while continuing to address the underlying issue.
1016,Your courage will guide your future.,2026-01-03,your-courage-will-guide-your-future,Courage,Future opportunities may require decisive action despite uncertainty. Trust your ability to move forward even when the outcome is not guaranteed.